<!ELEMENT list (superpoint)*>
<!ELEMENT superpoint (node)*>
<!ATTLIST superpoint
	name CDATA #REQUIRED
	type CDATA #REQUIRED
	is_running CDATA #IMPLIED>
<!ELEMENT node (#PCDATA)>
<!ATTLIST node
	chat_type CDATA #IMPLIED
	delay CDATA #IMPLIED
	npc_string CDATA #IMPLIED
	social CDATA #IMPLIED
	x CDATA #REQUIRED
	y CDATA #REQUIRED
	z CDATA #REQUIRED>